{
  "ok": true,
  "command": "consume",
  "path": null,
  "data": {
    "format": "BAM",
    "mode": "alignment",
    "dry_run": false,
    "inputs": {
      "requested_paths": [
        "-"
      ],
      "directories_scanned": 0,
      "files_discovered": 1,
      "files_consumed": 1,
      "files_skipped": 0,
      "files_rejected": 0
    },
    "discovery": {
      "recursive": false,
      "formats_detected": {
        "SAM": 1
      },
      "consumed_files": [
        {
          "path": "-",
          "detected_format": "SAM",
          "consumed": true,
          "reason": null
        }
      ]
    },
    "reference": {
      "policy": "strict",
      "explicit_reference_provided": false,
      "reference_cache_provided": false,
      "cram_inputs_present": false
    },
    "output": {
      "path": "acceptor.name.bam",
      "written": true,
      "records_written": 2,
      "sort_order": "queryname",
      "memory_limit": 8589934592,
      "compression_level": 1,
      "primary_only": true,
      "records_filtered": 1,
      "temporary_runs": 2,
      "mapped_state": "mapped_or_mixed"
    },
    "header": {
      "strategy": "streamed_sam_header",
      "reference_compatibility": "compatible",
      "sample": null,
      "read_group": null,
      "platform": null
    },
    "index": {
      "requested": false,
      "created": false,
      "kind": null
    },
    "checksum_verification": {
      "requested": false,
      "performed": false,
      "mode": null,
      "match": null
    },
    "notes": [
      "Uncompressed SAM was parsed directly from stdin without staging a complete SAM or unsorted BAM."
    ]
  },
  "error": null
}
