{
  "ok": true,
  "command": "consume",
  "path": null,
  "data": {
    "format": "BAM",
    "mode": "alignment",
    "dry_run": false,
    "inputs": {
      "requested_paths": [
        "sample.cram",
        "extra.bam"
      ],
      "directories_scanned": 0,
      "files_discovered": 2,
      "files_consumed": 2,
      "files_skipped": 0,
      "files_rejected": 0
    },
    "discovery": {
      "recursive": false,
      "formats_detected": {
        "BAM": 1,
        "CRAM": 1
      },
      "consumed_files": [
        {
          "path": "extra.bam",
          "detected_format": "BAM",
          "consumed": true,
          "reason": null
        },
        {
          "path": "sample.cram",
          "detected_format": "CRAM",
          "consumed": true,
          "reason": null
        }
      ],
      "skipped_files": [],
      "rejected_files": []
    },
    "reference": {
      "policy": "strict",
      "explicit_reference_provided": true,
      "reference_cache_provided": false,
      "cram_inputs_present": true,
      "source_used": "explicit_fasta",
      "decode_without_external_reference": false
    },
    "output": {
      "path": "combined.bam",
      "written": true,
      "records_written": 42180321,
      "sort_order": "none",
      "mapped_state": "mapped_or_mixed",
      "compression_level": 6
    },
    "header": {
      "strategy": "first_compatible_alignment_header",
      "reference_compatibility": "compatible",
      "sample": null,
      "read_group": null,
      "platform": null
    },
    "index": {
      "requested": false,
      "created": false,
      "kind": null
    },
    "checksum_verification": {
      "requested": false,
      "performed": false,
      "mode": null,
      "match": null
    },
    "notes": [
      "Directory traversal is lexical by normalized path string; directories are scanned top-level only unless --recursive is supplied, and symlinks are not followed in this slice.",
      "CRAM ingestion is governed by the strict reference policy; Bamana does not silently guess CRAM reference behavior.",
      "Alignment-bearing inputs were normalized into BAM.",
      "Alignment compatibility currently requires identical reference dictionaries across all alignment inputs.",
      "CRAM input was decoded under an explicit indexed FASTA reference policy.",
      "Multiple alignment inputs were concatenated in deterministic discovery order, so @HD sort metadata was rewritten to unsorted."
    ]
  },
  "error": null
}
