{
  "ok": true,
  "command": "consume",
  "path": null,
  "data": {
    "format": "BAM",
    "mode": "alignment",
    "dry_run": false,
    "inputs": {
      "requested_paths": [
        "sample.cram"
      ],
      "directories_scanned": 0,
      "files_discovered": 1,
      "files_consumed": 1,
      "files_skipped": 0,
      "files_rejected": 0
    },
    "discovery": {
      "recursive": false,
      "formats_detected": {
        "CRAM": 1
      },
      "consumed_files": [
        {
          "path": "sample.cram",
          "detected_format": "CRAM",
          "consumed": true,
          "reason": null
        }
      ],
      "skipped_files": [],
      "rejected_files": []
    },
    "reference": {
      "policy": "allow-embedded",
      "explicit_reference_provided": false,
      "reference_cache_provided": false,
      "cram_inputs_present": true,
      "source_used": "embedded_or_not_required",
      "decode_without_external_reference": true
    },
    "output": {
      "path": "sample.bam",
      "written": true,
      "records_written": 2100000,
      "sort_order": "none",
      "mapped_state": "mapped_or_mixed",
      "compression_level": 6
    },
    "header": {
      "strategy": "decoded_cram_header",
      "reference_compatibility": "compatible",
      "sample": null,
      "read_group": null,
      "platform": null
    },
    "index": {
      "requested": false,
      "created": false,
      "kind": null
    },
    "checksum_verification": {
      "requested": false,
      "performed": false,
      "mode": null,
      "match": null
    },
    "notes": [
      "Directory traversal is lexical by normalized path string; directories are scanned top-level only unless --recursive is supplied, and symlinks are not followed in this slice.",
      "CRAM ingestion is governed by the allow-embedded reference policy; Bamana does not silently guess CRAM reference behavior.",
      "Alignment-bearing inputs were normalized into BAM.",
      "Alignment compatibility currently requires identical reference dictionaries across all alignment inputs.",
      "CRAM decoding completed without an explicit external FASTA under the selected conservative policy."
    ]
  },
  "error": null
}
