{
  "ok": true,
  "command": "check_index",
  "path": "sample.bam",
  "data": {
    "format": "BAM",
    "index": {
      "present": true,
      "selected_path": "sample.bam.bai",
      "kind": "BAI",
      "support_level": "read_write",
      "usable": true,
      "syntactically_valid": true,
      "stale": false,
      "bam_newer_than_index": false,
      "compatibility": "plausible"
    },
    "candidates": [
      {
        "path": "sample.bam.bai",
        "kind": "BAI",
        "support_level": "read_write",
        "exists": true
      }
    ],
    "notes": [
      "Index presence and BAI structural validation checks passed."
    ]
  },
  "error": null
}
