{
  "ok": true,
  "command": "summary",
  "path": "example.bam",
  "data": {
    "format": "BAM",
    "mode": "full_scan",
    "evidence": {
      "header_used": true,
      "index_used": false,
      "records_scanned": 125000,
      "full_file_scanned": true
    },
    "header": {
      "references_defined": 25,
      "sort_order": "coordinate",
      "sub_sort_order": null,
      "group_order": null
    },
    "counts": {
      "records_examined": 125000,
      "records_total_known": 125000,
      "mapped_records": 124765,
      "unmapped_records": 235
    },
    "fractions": {
      "fraction_mapped": 0.99812
    },
    "mapq": {
      "min": 0,
      "max": 60,
      "mean": 57.4,
      "zero_count": 188
    },
    "mapping": {
      "status": "mapped",
      "references_with_mapped_reads": 24
    },
    "anomalies": {
      "contradictory_mapping_state_records": 0
    },
    "confidence": "high",
    "semantic_note": "Summary metrics are derived from a full alignment-record scan but are not a substitute for full BAM structural validation."
  },
  "error": null
}
